{
  "version": 1,
  "trip": {
    "title": "Vellmoor & the Tide Coast",
    "subtitle": "Three days, slowly",
    "destination": "Vellmoor",
    "country": "Ostenia",
    "start_date": "2026-11-12",
    "end_date": "2026-11-14",
    "timezone": "Etc/GMT-1",
    "locale": "en-US",
    "travelers": ["Jo", "Sam"],
    "prepared_for": "Jo & Sam",
    "pace": "relaxed",
    "day_start": "09:00",
    "day_end": "21:30",
    "intro": "Vellmoor is a small harbour city that turns its back on the wind: the old town climbs away from the quays in terraces, and almost everything you want is within a forty-minute walk. This plan keeps mornings for the things that need an early start, leaves the afternoons loose, and never books two timed entries on the same day.\n\nTides matter here. The sea baths and the Sallow Island ferry both run to the tide table, so the third day is built around it.",
    "lodging": [
      { "name": "The Marram Inn", "address": "4 Gull Steps, Rookwell, Vellmoor", "from": "2026-11-11", "to": "2026-11-14", "lat": 47.3121, "lng": -22.8134, "check_in": "15:00", "check_out": "11:00", "maps_url": "https://maps.example.com/?q=The+Marram+Inn", "note": "Breakfast 7:30–10:00 in the back room; ask for the harbour side if a room frees up." }
    ],
    "build_id": "sample-0001",
    "built_on": "2026-10-01",
    "verified_on": "2026-10-01"
  },
  "days": [
    {
      "date": "2026-11-12",
      "theme": "Old town and the quays",
      "summary": "A gentle first day on foot. The museum needs the early slot; after that everything is downhill towards the water, with the belfry as the one climb.",
      "lodging": "The Marram Inn",
      "stops": [
        { "place": "tide-museum", "arrive": "09:30", "depart": "11:30", "activity": "Highlights: the tide engine, the chart room", "minutes": 120, "booked": "Timed entry 9:30, booked", "note": "Start on the top floor and work down; the tide engine runs on the hour." },
        { "place": "lantern-quay", "arrive": "11:45", "depart": "12:45", "activity": "Market browse", "minutes": 60, "note": "Smoked-fish stalls at the east end; the cheese man closes at one." },
        { "place": "saint-aurel", "arrive": "14:15", "depart": "15:15", "activity": "Belfry climb, 212 steps", "minutes": 60 },
        { "place": "rookwell", "arrive": "15:30", "depart": "17:00", "activity": "Self-guided walk: Gull Steps, Tanners' Court, the almshouses", "minutes": 90, "note": "The route is on the place card; allow longer if the light is good." }
      ],
      "legs": [
        { "from": "lodging", "to": "tide-museum", "mode": "walk", "minutes": 12, "distance_m": 900, "depart_at": "09:15", "arrive_at": "09:27", "maps_url": "https://maps.example.com/dir/?from=marram-inn&to=tide-museum&mode=walking" },
        { "from": "tide-museum", "to": "lantern-quay", "mode": "walk", "minutes": 9, "distance_m": 650, "depart_at": "11:33", "arrive_at": "11:42", "maps_url": "https://maps.example.com/dir/?from=tide-museum&to=lantern-quay&mode=walking" },
        { "from": "lantern-quay", "to": "quillet", "mode": "walk", "minutes": 4, "distance_m": 300, "depart_at": "12:50", "arrive_at": "12:54", "maps_url": "https://maps.example.com/dir/?from=lantern-quay&to=quillet&mode=walking" },
        { "from": "quillet", "to": "saint-aurel", "mode": "walk", "minutes": 11, "distance_m": 800, "depart_at": "14:02", "arrive_at": "14:13", "maps_url": "https://maps.example.com/dir/?from=quillet&to=saint-aurel&mode=walking" },
        { "from": "saint-aurel", "to": "rookwell", "mode": "walk", "minutes": 8, "distance_m": 550, "depart_at": "15:18", "arrive_at": "15:26", "maps_url": "https://maps.example.com/dir/?from=saint-aurel&to=rookwell&mode=walking" },
        { "from": "rookwell", "to": "lodging", "mode": "walk", "minutes": 6, "distance_m": 400, "depart_at": "17:00", "arrive_at": "17:06", "maps_url": "https://maps.example.com/dir/?from=rookwell&to=marram-inn&mode=walking" },
        { "from": "lodging", "to": "brine-house", "mode": "walk", "minutes": 14, "distance_m": 1000, "depart_at": "18:42", "arrive_at": "18:56", "maps_url": "https://maps.example.com/dir/?from=marram-inn&to=brine-house&mode=walking", "note": "Along the sea wall if it is dry" }
      ],
      "meals": [
        { "kind": "breakfast", "start": "08:00", "end": "08:45", "name": "The Marram Inn, back room", "note": "Included; the porridge is the thing to order." },
        { "kind": "lunch", "start": "13:00", "end": "14:00", "place": "quillet", "note": "No booking needed before one." },
        { "kind": "dinner", "start": "19:00", "place": "brine-house", "note": "Booked for two under Sam." }
      ],
      "free": [{ "start": "17:06", "end": "18:40", "note": "Back to the inn — or the sea wall for sunset at 16:48 if you cut the walk short." }],
      "warnings": [
        { "severity": "info", "text": "Museum last entry 16:00; the chart room closes thirty minutes before the rest.", "place": "tide-museum" },
        { "severity": "warn", "text": "The belfry's top flight is steep and unlit — skip it if the knee is complaining; the view from the bell loft is nearly as good.", "place": "saint-aurel" }
      ],
      "verified_on": "2026-10-01"
    },
    {
      "date": "2026-11-13",
      "theme": "Gardens, glass and the high road",
      "summary": "Out to the terraces on the tram, a workshop you have already booked, and the viewpoint for the late light. Two bus rides; the day pass covers both.",
      "lodging": "The Marram Inn",
      "stops": [
        { "place": "hollin-terraces", "arrive": "09:40", "depart": "12:00", "activity": "Upper terraces first, glasshouse last", "minutes": 140, "note": "The glasshouse warms up by eleven; save it for the end." },
        { "place": "glass-foundry", "arrive": "13:30", "depart": "15:00", "activity": "Blowing demonstration 13:45; your workshop slot 14:15", "minutes": 90, "booked": "Workshop 14:15, booked — reference in the confirmation e-mail" },
        { "place": "mirrowdale", "arrive": "15:45", "depart": "16:45", "activity": "Viewpoint and the short ridge loop", "minutes": 60, "note": "The loop is 25 minutes; the bench at the far end faces the islands." }
      ],
      "legs": [
        { "from": "lodging", "to": "cinder-lane", "mode": "walk", "minutes": 5, "distance_m": 350, "depart_at": "08:25", "arrive_at": "08:30", "maps_url": "https://maps.example.com/dir/?from=marram-inn&to=cinder-lane&mode=walking" },
        { "from": "cinder-lane", "to": "hollin-terraces", "mode": "transit", "minutes": 22, "distance_m": 4100, "depart_at": "09:12", "arrive_at": "09:34", "line": "Tram 4 toward Hollin Gate, 6 stops", "maps_url": "https://maps.example.com/dir/?from=cinder-lane&to=hollin-terraces&mode=transit&time=0912" },
        { "from": "hollin-terraces", "to": "glass-foundry", "mode": "walk", "minutes": 14, "distance_m": 1100, "depart_at": "13:05", "arrive_at": "13:19", "maps_url": "https://maps.example.com/dir/?from=hollin-terraces&to=glass-foundry&mode=walking" },
        { "from": "glass-foundry", "to": "mirrowdale", "mode": "transit", "minutes": 28, "distance_m": 6200, "depart_at": "15:10", "arrive_at": "15:38", "line": "Bus 11 to Mirrowdale Top", "maps_url": "https://maps.example.com/dir/?from=glass-foundry&to=mirrowdale&mode=transit&time=1510" },
        { "from": "mirrowdale", "to": "lodging", "mode": "transit", "minutes": 35, "distance_m": 7400, "depart_at": "16:50", "arrive_at": "17:25", "line": "Bus 11 to Quay Street, then 6 min on foot", "maps_url": "https://maps.example.com/dir/?from=mirrowdale&to=marram-inn&mode=transit&time=1650" }
      ],
      "meals": [
        { "kind": "coffee", "start": "08:30", "end": "09:05", "place": "cinder-lane", "note": "The cardamom bun; they sell out by ten." },
        { "kind": "lunch", "start": "12:00", "end": "13:00", "name": "Terrace Café, inside the gardens", "note": "Soup and a tart; sit on the lower terrace out of the wind." },
        { "kind": "dinner", "start": "19:30", "name": "Open — two ideas in the Later list", "note": "Nothing booked. If it rains, stay near the inn." }
      ],
      "free": [{ "start": "17:25", "end": "19:30", "note": "Rest. Or the Fennick bookshop today instead of Saturday, if the island day looks full." }],
      "warnings": [
        { "severity": "warn", "text": "The workshop needs closed shoes and long hair tied back; no loose scarves.", "place": "glass-foundry" },
        { "severity": "info", "text": "Bus 11 runs every twenty minutes; the 15:10 is the one to catch for the light at the top." }
      ],
      "verified_on": "2026-10-01"
    },
    {
      "date": "2026-11-14",
      "theme": "The island and the sea",
      "summary": "Built around the tide: the 9:15 sailing out, the 13:15 back, then the sea baths while the water is highest. The bookshop closes the trip.",
      "lodging": "The Marram Inn",
      "stops": [
        { "place": "sallow-island", "arrive": "10:00", "depart": "12:30", "activity": "Chapel, the lighthouse path, lunch by the chapel", "minutes": 150, "note": "The lighthouse path is 50 minutes there and back; the chapel key is at the kiosk." },
        { "place": "harbour-baths", "arrive": "14:30", "depart": "15:45", "activity": "Heated pool, cold plunge, the sauna if it is open", "minutes": 75, "note": "Towels for hire; bring the swimsuits in the day bag." },
        { "place": "fennick", "arrive": "16:15", "depart": "17:15", "activity": "The travel room upstairs", "minutes": 60, "note": "They post abroad, so buy heavy." }
      ],
      "legs": [
        { "from": "lodging", "to": "sallow-island", "mode": "ferry", "minutes": 40, "distance_m": 5200, "depart_at": "09:15", "arrive_at": "09:55", "line": "Sallow Island ferry, 09:15 sailing from Lantern Quay (10 min on foot from the inn)", "maps_url": "https://maps.example.com/dir/?from=marram-inn&to=sallow-island" },